,outcome,arm 1,arm 2
0,intervention,,
0,"neutrophil nadir, total study group",mean +/- SD,mean +/- SD
0,"neutrophil nadir, mean neutrophil count, proportion of patients with a neutrophil count, total study group","1030 +/- 580/microL, 490 +/- 310/microL, 550 +/- 350/microL, 690 +/- 370/microL, six of 35 or","1030 +/- 580/microL, 490 +/- 310/microL, 550 +/- 350/microL, 690 +/- 370/microL, six of 35 or"
0,"proportion of patients with a neutrophil count, neutrophil nadir, mean neutrophil count, 16 the, total study group",17 . 1 %,17 . 1 %
0,"mean neutrophil count, proportion of patients with a neutrophil count, total study group","12 of 34 or, 35.3 %","12 of 34 or, 35.3 %"
